{
  "insured_name": "Rivera Fabrication LLC",
  "insured_address": "1420 Foundry Road, Toledo OH 43604",
  "policy_number": "WC-8842317-01",
  "effective_date": "2026-04-01",
  "expiration_date": "2027-04-01",
  "carrier": "Sentinel Insurance Company",
  "producer": "Hanover Risk Partners",
  "total_premium": 47250.00,
  "line_of_business": "workers_comp",
  "coverage_schedule": [
    {"coverage_name": "Workers Compensation", "limit": 1000000.00, "deductible": null, "premium": 44100.00},
    {"coverage_name": "Employers Liability", "limit": 500000.00, "deductible": null, "premium": 3150.00}
  ],
  "endorsements": ["WC 00 03 13", "WC 00 04 21"]
}
